{
  "version": "1.0",
  "workspace": {
    "name": "Pedidos en línea",
    "description": "Integración del flujo de pedido de una tienda"
  },
  "nodes": [
    {
      "id": "tienda-web",
      "kind": "system",
      "name": "Tienda web",
      "technology": "React",
      "owner": "Equipo Web"
    },
    {
      "id": "gateway",
      "kind": "gateway",
      "name": "API Gateway",
      "technology": "Kong",
      "owner": "Plataforma",
      "domain": "Plataforma"
    },
    {
      "id": "pedidos",
      "kind": "system",
      "name": "Servicio de pedidos",
      "technology": "Java, Spring Boot",
      "owner": "Equipo Pedidos",
      "domain": "Pedidos"
    },
    {
      "id": "pedidos-api",
      "kind": "api",
      "name": "API de pedidos",
      "parentId": "pedidos",
      "contractId": "pedidos-openapi",
      "owner": "Equipo Pedidos"
    },
    {
      "id": "kafka",
      "kind": "broker",
      "name": "Kafka",
      "owner": "Plataforma",
      "domain": "Plataforma"
    },
    {
      "id": "pedido-creado",
      "kind": "topic",
      "name": "pedido-creado",
      "parentId": "kafka",
      "contractId": "pedido-creado-ce"
    },
    {
      "id": "pedidos-db",
      "kind": "store",
      "name": "Base de pedidos",
      "technology": "PostgreSQL",
      "domain": "Pedidos"
    },
    {
      "id": "facturacion",
      "kind": "system",
      "name": "Facturación",
      "technology": ".NET",
      "owner": "Equipo Finanzas",
      "domain": "Finanzas"
    },
    {
      "id": "pasarela-pagos",
      "kind": "system",
      "name": "Pasarela de pagos",
      "external": true
    },
    {
      "id": "cliente",
      "kind": "user",
      "name": "Cliente",
      "description": "Persona que compra en la tienda"
    },
    {
      "id": "asistente",
      "kind": "system",
      "name": "Asistente de compras",
      "technology": "Agente de IA",
      "external": true
    },
    {
      "id": "pedidos-mcp",
      "kind": "mcp",
      "name": "MCP de pedidos",
      "technology": "MCP sobre HTTP",
      "parentId": "pedidos",
      "contractId": "pedidos-mcp-manifest"
    },
    {
      "id": "facturacion-api",
      "kind": "api",
      "name": "API de facturación",
      "technology": "gRPC",
      "parentId": "facturacion",
      "contractId": "facturacion-proto",
      "owner": "Equipo Finanzas"
    },
    {
      "id": "traducir-erp",
      "kind": "pattern",
      "name": "Traductor a formato ERP",
      "pattern": "message-translator",
      "domain": "Plataforma"
    },
    {
      "id": "exportador-erp",
      "kind": "connector",
      "name": "Exportador al ERP",
      "technology": "Apache Camel",
      "owner": "Equipo Finanzas",
      "domain": "Finanzas"
    },
    {
      "id": "erp",
      "kind": "system",
      "name": "ERP corporativo",
      "external": true
    },
    {
      "id": "reintento-pagos",
      "kind": "scheduler",
      "name": "Reintento de cobros",
      "technology": "cron cada 15 min",
      "owner": "Equipo Finanzas",
      "domain": "Finanzas"
    }
  ],
  "contracts": [
    {
      "id": "pedidos-openapi",
      "name": "API de pedidos",
      "format": "openapi",
      "version": "2.1.0",
      "content": "{\n  \"openapi\": \"3.0.3\",\n  \"info\": {\n    \"title\": \"API de pedidos\",\n    \"version\": \"2.1.0\",\n    \"description\": \"Alta y consulta de pedidos de la tienda.\"\n  },\n  \"servers\": [\n    {\n      \"url\": \"https://api.tienda.example/pedidos/v2\"\n    }\n  ],\n  \"paths\": {\n    \"/pedidos\": {\n      \"post\": {\n        \"operationId\": \"crearPedido\",\n        \"summary\": \"Crea un pedido\",\n        \"requestBody\": {\n          \"required\": true,\n          \"content\": {\n            \"application/json\": {\n              \"schema\": {\n                \"$ref\": \"#/components/schemas/NuevoPedido\"\n              }\n            }\n          }\n        },\n        \"responses\": {\n          \"201\": {\n            \"description\": \"Pedido creado\",\n            \"content\": {\n              \"application/json\": {\n                \"schema\": {\n                  \"$ref\": \"#/components/schemas/Pedido\"\n                }\n              }\n            }\n          },\n          \"422\": {\n            \"description\": \"Pedido inválido\"\n          }\n        }\n      }\n    },\n    \"/pedidos/{id}\": {\n      \"get\": {\n        \"operationId\": \"consultarPedido\",\n        \"summary\": \"Consulta un pedido\",\n        \"parameters\": [\n          {\n            \"name\": \"id\",\n            \"in\": \"path\",\n            \"required\": true,\n            \"schema\": {\n              \"type\": \"string\"\n            }\n          }\n        ],\n        \"responses\": {\n          \"200\": {\n            \"description\": \"El pedido\",\n            \"content\": {\n              \"application/json\": {\n                \"schema\": {\n                  \"$ref\": \"#/components/schemas/Pedido\"\n                }\n              }\n            }\n          },\n          \"404\": {\n            \"description\": \"No existe\"\n          }\n        }\n      }\n    }\n  },\n  \"components\": {\n    \"schemas\": {\n      \"NuevoPedido\": {\n        \"type\": \"object\",\n        \"required\": [\n          \"clienteId\",\n          \"lineas\"\n        ],\n        \"properties\": {\n          \"clienteId\": {\n            \"type\": \"string\"\n          },\n          \"lineas\": {\n            \"type\": \"array\",\n            \"items\": {\n              \"type\": \"object\",\n              \"properties\": {\n                \"sku\": {\n                  \"type\": \"string\"\n                },\n                \"cantidad\": {\n                  \"type\": \"integer\",\n                  \"minimum\": 1\n                }\n              }\n            }\n          }\n        }\n      },\n      \"Pedido\": {\n        \"type\": \"object\",\n        \"properties\": {\n          \"id\": {\n            \"type\": \"string\"\n          },\n          \"estado\": {\n            \"type\": \"string\",\n            \"enum\": [\n              \"creado\",\n              \"pagado\",\n              \"enviado\"\n            ]\n          },\n          \"total\": {\n            \"type\": \"number\"\n          }\n        }\n      }\n    }\n  }\n}"
    },
    {
      "id": "pedido-creado-avro",
      "name": "Evento PedidoCreado",
      "format": "avro",
      "version": "1.3",
      "content": "{\n  \"type\": \"record\",\n  \"name\": \"PedidoCreado\",\n  \"namespace\": \"com.tienda.pedidos\",\n  \"fields\": [\n    {\n      \"name\": \"pedidoId\",\n      \"type\": \"string\"\n    },\n    {\n      \"name\": \"clienteId\",\n      \"type\": \"string\"\n    },\n    {\n      \"name\": \"total\",\n      \"type\": \"double\"\n    },\n    {\n      \"name\": \"creadoEn\",\n      \"type\": {\n        \"type\": \"long\",\n        \"logicalType\": \"timestamp-millis\"\n      }\n    }\n  ]\n}"
    },
    {
      "id": "pedido-creado-ce",
      "name": "Evento PedidoCreado (CloudEvents)",
      "format": "cloudevents",
      "version": "1.3",
      "description": "Estructura CloudEvents 1.0 del evento publicado en el tópico.",
      "content": "{\n  \"specversion\": \"1.0\",\n  \"id\": \"A234-1234-1234\",\n  \"source\": \"/pedidos\",\n  \"type\": \"com.tienda.pedido.creado\",\n  \"datacontenttype\": \"application/json\",\n  \"dataschema\": \"https://schemas.tienda.example/pedido-creado/1.3\",\n  \"subject\": \"pedido/1042\",\n  \"time\": \"2026-03-01T10:15:30Z\",\n  \"data\": {\n    \"pedidoId\": \"1042\",\n    \"clienteId\": \"c-77\",\n    \"total\": 129.9\n  }\n}"
    },
    {
      "id": "facturacion-proto",
      "name": "Servicio de facturación",
      "format": "protobuf",
      "version": "1.0.0",
      "description": "Contrato gRPC de consulta de facturas.",
      "content": "syntax = \"proto3\";\n\npackage tienda.facturacion.v1;\n\n// Consulta del estado de facturación de un pedido.\nservice FacturacionService {\n  rpc ConsultarFactura (ConsultarFacturaRequest) returns (Factura);\n  rpc SuscribirEstados (SuscribirEstadosRequest) returns (stream EstadoFactura);\n}\n\nmessage ConsultarFacturaRequest {\n  string pedido_id = 1;\n}\n\nmessage SuscribirEstadosRequest {\n  string cliente_id = 1;\n}\n\nmessage Factura {\n  string id = 1;\n  string pedido_id = 2;\n  double total = 3;\n  Estado estado = 4;\n}\n\nmessage EstadoFactura {\n  string factura_id = 1;\n  Estado estado = 2;\n}\n\nenum Estado {\n  ESTADO_DESCONOCIDO = 0;\n  EMITIDA = 1;\n  COBRADA = 2;\n  ANULADA = 3;\n}\n"
    },
    {
      "id": "pedidos-mcp-manifest",
      "name": "Herramientas MCP de pedidos",
      "format": "mcp",
      "version": "1.0.0",
      "description": "Lo que un agente de IA puede hacer con los pedidos.",